{
  "spec_version": 1,
  "goal": "Create an API key for the staging environment",
  "where": "Resend Dashboard → API Keys",
  "url": "https://resend.com/api-keys",
  "why_human": "The key is shown once and must never pass through the agent.",
  "values": {
    "key_name": "staging-mailer"
  },
  "secrets": {
    "RESEND_API_KEY": ".env.staging",
    "RESEND_WEBHOOK_SECRET": "config/secrets/staging.env"
  },
  "steps": [
    {
      "text": "Press Create API Key and name it staging-mailer.",
      "values": ["key_name"]
    },
    {
      "text": "Copy the key into .env.staging as RESEND_API_KEY.",
      "warning": "The key is displayed only once."
    },
    {
      "text": "Open the webhook settings and copy the signing secret into config/secrets/staging.env as RESEND_WEBHOOK_SECRET."
    }
  ],
  "verify": "Check that RESEND_API_KEY exists in .env.staging without reading its value, then send a staging test email and confirm it is delivered."
}
